title,year,authors,key,ee,venue_category
On CAD Informed Adaptive Robotic Assembly.,2022,Yotto Koga & Heather Kerrick & Sachin Chitta,conf/iros/KogaKC22,https://doi.org/10.1109/IROS47612.2022.9982242,Robotics
Stabilizing Neural Control Using Self-Learned Almost Lyapunov Critics.,2021,Ya-Chien Chang & Sicun Gao,conf/icra/ChangG21,https://doi.org/10.1109/ICRA48506.2021.9560886,Robotics
An adaptive basic I/O gain tuning method based on leveling control input histogram for human-machine systems.,2014,Mitsuhiro Kamezaki & Hiroyasu Iwata & Shigeki Sugano,conf/iros/KamezakiIS14,https://doi.org/10.1109/IROS.2014.6942817,Robotics
Simultaneous Self-Calibration of Nonorthogonality and Nonlinearity of Cost-Effective Multiaxis Inertially Stabilized Gimbal Systems.,2018,Fu Zhang,journals/ral/Zhang18,https://doi.org/10.1109/LRA.2017.2734968,Robotics
Adaptive force/velocity control for multi-robot cooperative manipulation under uncertain kinematic parameters.,2013,Sebastian Erhart & Sandra Hirche,conf/iros/ErhartH13,https://doi.org/10.1109/IROS.2013.6696369,Robotics
Timed automata based motion planning for a self-assembly robot system.,2014,Rui Wang 0024 & Ping Luo & Yong Guan & Hongxing Wei & Xiaojuan Li & Jie Zhang 0074 & Xiaoyu Song,conf/icra/WangLGWLZS14,https://doi.org/10.1109/ICRA.2014.6907686,Robotics
Sustainable robot foraging: Adaptive fine-grained multi-robot task allocation for maximum sustainable yield of biological resources.,2013,Zhao Song 0002 & Richard T. Vaughan,conf/iros/SongV13,https://doi.org/10.1109/IROS.2013.6696827,Robotics
An Omnidirectional Jumper with Expanded Movability via Steering; Self-Righting and Take-off Angle Adjustment.,2018,Sojung Yim & Sang-Min Baek & Gwang-Pil Jung & Kyu-Jin Cho,conf/iros/YimBJC18,https://doi.org/10.1109/IROS.2018.8594372,Robotics
Adaptive grip control on an uncertain object.,2012,Allen Jiang & João Bimbo & Simon Goulder & Hongbin Liu 0001 & Xiaojing Song & Prokar Dasgupta & Kaspar Althoefer & D. P. Thrishantha Nanayakkara,conf/iros/JiangBGLSDAN12,https://doi.org/10.1109/IROS.2012.6385922,Robotics
Adaptive optimal control for coordination in physical human-robot interaction.,2015,Yanan Li 0001 & Keng Peng Tee & Rui Yan & Wei Liang Chan & Yan Wu 0002 & Dilip Kumar Limbu,conf/iros/LiTYCWL15,https://doi.org/10.1109/IROS.2015.7353109,Robotics
Pit30M: A Benchmark for Global Localization in the Age of Self-Driving Cars.,2020,Julieta Martinez & Sasha Doubov & Jack Fan & Ioan Andrei Bârsan & Shenlong Wang & Gellért Máttyus & Raquel Urtasun,conf/iros/MartinezDFBWMU20,https://doi.org/10.1109/IROS45743.2020.9340924,Robotics
Restoring Force Design of Active Self-healing Tension Transmission System and Application to Tendon-driven Legged Robot.,2021,Shinsuke Nakashima & Kento Kawaharazuka & Manabu Nishiura & Yuki Asano & Yohei Kakiuchi & Kei Okada & Koji Kawasaki & Masayuki Inaba,conf/icra/NakashimaKNAKOK21,https://doi.org/10.1109/ICRA48506.2021.9561531,Robotics
Increased robustness of humanoid standing balance in the sagittal plane through adaptive joint torque reduction.,2013,Markus Giftthaler & Katie Byl,conf/iros/GiftthalerB13,https://doi.org/10.1109/IROS.2013.6696948,Robotics
Adaptive Sampling and Online Learning in Multi-Robot Sensor Coverage with Mixture of Gaussian Processes.,2018,Wenhao Luo & Katia P. Sycara,conf/icra/LuoS18,https://doi.org/10.1109/ICRA.2018.8460473,Robotics
Applying Architecture-Based Adaptation to Automate the Management of Internet-of-Things.,2018,Danny Weyns & M. Usman Iftikhar & Danny Hughes 0001 & Nelson Matthys,conf/ecsa/WeynsI0M18,https://doi.org/10.1007/978-3-030-00761-4_4,Software_Architecture
Adaptive trajectory control of off-road mobile robots: A multi-model observer approach.,2017,Mathieu Deremetz & Roland Lenain & Benoît Thuilot & Vincent Rousseau,conf/icra/DeremetzLTR17,https://doi.org/10.1109/ICRA.2017.7989509,Robotics
Feedback-controlled self-folding of autonomous robot collectives.,2016,Martin E. W. Nisser & Samuel M. Felton & Michael Thomas Tolley & Michael Rubenstein & Robert J. Wood,conf/iros/NisserFTRW16,https://doi.org/10.1109/IROS.2016.7759208,Robotics
Design and architecture of the unified modular snake robot.,2012,Cornell Wright III & Austin Buchan & Ben Brown & Jason Geist & Michael Schwerin & David Rollinson & Matthew Tesch & Howie Choset,conf/icra/WrightBBGSRTC12,https://doi.org/10.1109/ICRA.2012.6225255,Robotics
Adaptive Traversability of unknown complex terrain with obstacles for mobile robots.,2014,Karel Zimmermann & Petr Zuzánek & Michal Reinstein & Václav Hlavác,conf/icra/ZimmermannZRH14,https://doi.org/10.1109/ICRA.2014.6907619,Robotics
Online Weight-adaptive Nonlinear Model Predictive Control.,2020,Dimche Kostadinov & Davide Scaramuzza 0001,conf/iros/Kostadinov020,https://doi.org/10.1109/IROS45743.2020.9341495,Robotics
Weakly-Supervised Domain Adaptation of Deep Regression Trackers via Reinforced Knowledge Distillation.,2021,Matteo Dunnhofer & Niki Martinel & Christian Micheloni,journals/ral/DunnhoferMM21,https://doi.org/10.1109/LRA.2021.3070816,Robotics
Decentralized Ability-Aware Adaptive Control for Multi-Robot Collaborative Manipulation.,2021,Lei Yan & Theodoros Stouraitis & Sethu Vijayakumar,journals/ral/YanSV21,https://doi.org/10.1109/LRA.2021.3060379,Robotics
Self-Supervised Online Learning for Safety-Critical Control using Stereo Vision.,2022,Ryan K. Cosner & Ivan D. Jimenez Rodriguez & Tamás G. Molnár & Wyatt Ubellacker & Yisong Yue & Aaron D. Ames & Katherine L. Bouman,conf/icra/CosnerRMUYAB22,https://doi.org/10.1109/ICRA46639.2022.9812183,Robotics
Continuous Role Adaptation for Human-Robot Shared Control.,2015,Yanan Li 0001 & Keng Peng Tee & Wei Liang Chan & Rui Yan & Yuanwei Chua & Dilip Kumar Limbu,journals/trob/LiTCYCL15,https://doi.org/10.1109/TRO.2015.2419873,Robotics
Real-time end-effector motion behavior planning approach using on-line point-cloud data towards a user adaptive assistive bath robot.,2017,Athanasios C. Dometios & Xanthi S. Papageorgiou & Antonis Arvanitakis & Costas S. Tzafestas & Petros Maragos,conf/iros/DometiosPATM17,https://doi.org/10.1109/IROS.2017.8206387,Robotics
Adaptive Compensation of Multiple Actuator Faults for Two Physically Linked 2WD Robots.,2018,Yajie Ma & Vincent Cocquempot & Maan El Badaoui El Najjar & Bin Jiang 0001,journals/trob/MaCNJ18,https://doi.org/10.1109/TRO.2017.2754518,Robotics
UnRectDepthNet: Self-Supervised Monocular Depth Estimation using a Generic Framework for Handling Common Camera Distortion Models.,2020,Varun Ravi Kumar & Senthil Kumar Yogamani & Markus Bach & Christian Witt & Stefan Milz & Patrick Mäder,conf/iros/KumarYBWMM20,https://doi.org/10.1109/IROS45743.2020.9340732,Robotics
A Multilayer-Multimodal Fusion Architecture for Pattern Recognition of Natural Manipulations in Percutaneous Coronary Interventions.,2020,Xiao-Hu Zhou & Xiao-Liang Xie & Zhen-Qiu Feng & Zeng-Guang Hou & Gui-Bin Bian & Rui-Qi Li & Zhen-Liang Ni & Shi-Qi Liu 0004 & Yan-Jie Zhou,conf/icra/ZhouXFHBLNLZ20,https://doi.org/10.1109/ICRA40945.2020.9197111,Robotics
Fusion of Stereo and Still Monocular Depth Estimates in a Self-Supervised Learning Context.,2018,Diogo Martins & Kevin van Hecke & Guido de Croon,conf/icra/MartinsHC18,https://doi.org/10.1109/ICRA.2018.8461116,Robotics
Adaptive Navigation Scheme for Optimal Deep-Sea Localization Using Multimodal Perception Cues.,2019,Arturo Gomez Chavez & Qingwen Xu & Christian A. Mueller & Sören Schwertfeger & Andreas Birk 0002,conf/iros/ChavezXMS019,https://doi.org/10.1109/IROS40897.2019.8967888,Robotics
Human guided trajectory and impedance adaptation for tele-operated physical assistance.,2021,Guillaume Gourmelen & Benjamin Navarro & Andrea Cherubini & Gowrishankar Ganesh,conf/iros/GourmelenNCG21,https://doi.org/10.1109/IROS51168.2021.9636418,Robotics
NAUTS: Negotiation for Adaptation to Unstructured Terrain Surfaces.,2022,Sriram Siva & Maggie B. Wigness & John G. Rogers & Long Quang & Hao Zhang,conf/iros/SivaWRQZ22,https://doi.org/10.1109/IROS47612.2022.9982207,Robotics
Self-supervised weed detection in vegetable crops using ground based hyperspectral imaging.,2016,Alexander Wendel & James Patrick Underwood,conf/icra/WendelU16,https://doi.org/10.1109/ICRA.2016.7487717,Robotics
Online SLAM with any-time self-calibration and automatic change detection.,2015,Nima Keivan & Gabe Sibley,conf/icra/KeivanS15,https://doi.org/10.1109/ICRA.2015.7140008,Robotics
PLATO: Policy learning using adaptive trajectory optimization.,2017,Gregory Kahn & Tianhao Zhang & Sergey Levine & Pieter Abbeel,conf/icra/KahnZLA17,https://doi.org/10.1109/ICRA.2017.7989379,Robotics
LUCIDGames: Online Unscented Inverse Dynamic Games for Adaptive Trajectory Prediction and Planning.,2021,Simon Le Cleac'h & Mac Schwager & Zachary Manchester,journals/ral/CleachSM21,https://doi.org/10.1109/LRA.2021.3074880,Robotics
Hierarchical adaptive planning in environments with uncertain; spatially-varying disturbance forces.,2014,Vishnu R. Desaraju & Nathan Michael,conf/icra/DesarajuM14,https://doi.org/10.1109/ICRA.2014.6907618,Robotics
Audio-visual keyword spotting based on adaptive decision fusion under noisy conditions for human-robot interaction.,2014,Hong Liu 0008 & Ting Fan & Pingping Wu,conf/icra/LiuFW14,https://doi.org/10.1109/ICRA.2014.6907840,Robotics
Active target tracking with self-triggered communications.,2017,Lifeng Zhou & Pratap Tokekar,conf/icra/ZhouT17,https://doi.org/10.1109/ICRA.2017.7989244,Robotics
Self-Adaptive Middleware for Wireless Sensor Networks: A Reference Architecture.,2015,Jesús M. T. Portocarrero & Flávia Coimbra Delicato & Paulo F. Pires & Elisa Yumi Nakagawa & Flávio Oquendo,conf/ecsa/PortocarreroDPN15,https://doi.org/10.1145/2797433.2797445,Software_Architecture
OmniClimber: An omnidirectional light weight climbing robot with flexibility to adapt to non-flat surfaces.,2012,Mahmoud Tavakoli & Lino Marques & Anibal T. de Almeida,conf/iros/TavakoliMA12,https://doi.org/10.1109/IROS.2012.6385454,Robotics
Adaptively Exploits Local Structure With Generalised Multi-Trees Motion Planning.,2022,Tin Lai & Fabio Ramos 0001,journals/ral/LaiR22,https://doi.org/10.1109/LRA.2021.3132985,Robotics
Dimensionality Reduction in Learning Gaussian Mixture Models of Movement Primitives for Contextualized Action Selection and Adaptation.,2018,Adria Colome & Carme Torras,journals/ral/ColomeT18,https://doi.org/10.1109/LRA.2018.2857921,Robotics
A Passivity-Based Bilateral Teleoperation Architecture using Distributed Nonlinear Model Predictive Control.,2020,Nicola Piccinelli & Riccardo Muradore,conf/iros/PiccinelliM20,https://doi.org/10.1109/IROS45743.2020.9341048,Robotics
Adaptive fovea for scanning depth sensors.,2020,Zaid Tasneem & Charuvahan Adhivarahan & Dingkang Wang & Huikai Xie & Karthik Dantu & Sanjeev J. Koppal,journals/ijrr/TasneemAWXDK20,https://doi.org/10.1177/0278364920920931,Robotics
Adaptive Outcome Selection for Planning with Reduced Models.,2019,Sandhya Saisubramanian & Shlomo Zilberstein,conf/iros/SaisubramanianZ19,https://doi.org/10.1109/IROS40897.2019.8967713,Robotics
Engagement Enhancement Based on Bayesian Optimization for Adaptive Assist-as-Needed Controller.,2022,Xiao Li 0018 & Hong Zeng & Jianxi Zhang & Aiguo Song,journals/ral/LiZZS22,https://doi.org/10.1109/LRA.2021.3118473,Robotics
AMI: Adaptive Motion Imitation Algorithm Based on Deep Reinforcement Learning.,2022,Nazita Taghavi & Moath H. A. Alqatamin & Dan O. Popa,conf/icra/TaghaviAP22,https://doi.org/10.1109/ICRA46639.2022.9812121,Robotics
Self-modeling Tracking Control of Crawler Fire Fighting Robot Based on Causal Network*.,2019,Wenkai Chang & Peng Li & Caiyun Yang & Tao Lu & Yinghao Cai & Shuo Wang 0001,conf/iros/ChangLYLCW19,https://doi.org/10.1109/IROS40897.2019.8968210,Robotics
Path-following control of a velocity constrained tracked vehicle incorporating adaptive slip estimation.,2012,Michael Burke,conf/icra/Burke12,https://doi.org/10.1109/ICRA.2012.6224684,Robotics
Self-discovery of motor primitives and learning grasp affordances.,2012,Emre Ugur & Erol Sahin & Erhan Öztop,conf/iros/UgurSO12,https://doi.org/10.1109/IROS.2012.6385639,Robotics
Open-loop self-calibration of articulated robots with artificial skins.,2012,Philipp Mittendorfer & Gordon Cheng,conf/icra/MittendorferC12,https://doi.org/10.1109/ICRA.2012.6224881,Robotics
Domain Curiosity: Learning Efficient Data Collection Strategies for Domain Adaptation.,2021,Karol Arndt & Oliver Struckmeier & Ville Kyrki,conf/iros/ArndtSK21,https://doi.org/10.1109/IROS51168.2021.9635864,Robotics
An Architecture for Decentralized; Collaborative; and Autonomous Robots.,2018,Sergio García 0002 & Claudio Menghi & Patrizio Pelliccione & Thorsten Berger & Rebekka Wohlrab,conf/icsa/GarciaMPBW18,https://doi.org/10.1109/ICSA.2018.00017,Software_Architecture
Exploiting linearity in dynamics solvers for the design of composable robotic manipulation architectures.,2019,Sven Schneider 0002 & Herman Bruyninckx,conf/iros/0002B19,https://doi.org/10.1109/IROS40897.2019.8968500,Robotics
A hybrid deep architecture for robotic grasp detection.,2017,Di Guo & Fuchun Sun 0001 & Huaping Liu 0001 & Tao Kong & Bin Fang 0003 & Ning Xi 0001,conf/icra/GuoSLKFX17,https://doi.org/10.1109/ICRA.2017.7989191,Robotics
Adaptive H∞ Controller for Precise Manoeuvring of a Space Robot.,2019,Asma Seddaoui & Chakravarthini M. Saaj & Steve Eckersley,conf/icra/SeddaouiSE19,https://doi.org/10.1109/ICRA.2019.8794374,Robotics
Soft-NeuroAdapt: A 3-DOF neuro-adaptive patient pose correction system for frameless and maskless cancer radiotherapy.,2017,Olalekan P. Ogunmolu & Adwait Kulkarni & Yonas Tadesse & Xuejun Gu & Steve B. Jiang & Nicholas R. Gans,conf/iros/OgunmoluKTGJG17,https://doi.org/10.1109/IROS.2017.8206211,Robotics
A Compliant Adaptive Gripper and Its Intrinsic Force Sensing Method.,2021,Wenfu Xu & Heng Zhang & Han Yuan & Bin Liang 0001,journals/trob/XuZYL21,https://doi.org/10.1109/TRO.2021.3060971,Robotics
Fast and Safe Exploration via Adaptive Semantic Perception in Outdoor Environments.,2022,Zhihao Wang & Lingxu Chen & Hongjin Chen & Haoyao Chen & Xin Jiang,conf/iros/WangCCCJ22,https://doi.org/10.1109/IROS47612.2022.9981640,Robotics
Integrated electro-aeromechanical structures for low-cost; self-deploying environment sensors and disposable UAVs.,2013,Paul E. I. Pounds & Surya P. N. Singh,conf/icra/PoundsS13,https://doi.org/10.1109/ICRA.2013.6631210,Robotics
ASSISTON-SE: A self-aligning shoulder-elbow exoskeleton.,2012,Mehmet Alper Ergin & Volkan Patoglu,conf/icra/ErginP12,https://doi.org/10.1109/ICRA.2012.6225117,Robotics
An Energy-Based Control Architecture for Shared Autonomy.,2022,Federico Benzi & Federica Ferraguti & Giuseppe Riggio & Cristian Secchi,journals/trob/BenziFRS22,https://doi.org/10.1109/TRO.2022.3180885,Robotics
Failing to Learn: Autonomously Identifying Perception Failures for Self-Driving Cars.,2018,Manikandasriram Srinivasan Ramanagopal & Cyrus Anderson & Ram Vasudevan & Matthew Johnson-Roberson,journals/ral/RamanagopalAVJ18,https://doi.org/10.1109/LRA.2018.2857402,Robotics
An origami-inspired; self-locking robotic arm that can be folded flat.,2018,Dae-Young Lee & Gwang-Pil Jung & Kyu-Jin Cho,journals/scirobotics/LeeJC18,https://doi.org/10.1126/scirobotics.aar2915,Robotics
Adaptive Unscented Kalman Filter-based Disturbance Rejection With Application to High Precision Hydraulic Robotic Control.,2019,Peng Lu 0003 & Timothy Sandy & Jonas Buchli,conf/iros/0003SB19,https://doi.org/10.1109/IROS40897.2019.8970476,Robotics
Modeling and reusing robotic software architectures: The HyperFlex toolchain.,2014,Luca Gherardi & Davide Brugali,conf/icra/GherardiB14,https://doi.org/10.1109/ICRA.2014.6907806,Robotics
Learning Intention Aware Online Adaptation of Movement Primitives.,2019,Dorothea Koert & Joni Pajarinen & Albert Schotschneider & Susanne Trick & Constantin A. Rothkopf & Jan Peters 0001,journals/ral/KoertPSTRP19,https://doi.org/10.1109/LRA.2019.2928760,Robotics
Adaptive Estimation of Measurement Bias in Three-Dimensional Field Sensors with Angular Rate Sensors: Theory and Comparative Experimental Evaluation.,2013,Giancarlo Troni & Louis L. Whitcomb,conf/rss/TroniW13,http://www.roboticsproceedings.org/rss09/p50.html,Robotics
Robust Adaptive Synchronization of Interconnected Heterogeneous Quadrotors Transporting a Cable-Suspended Load.,2021,Gustavo A. Cardona & Miguel F. Arevalo-Castiblanco & Duvan Tellez-Castro & Juan M. Calderón & Eduardo Mojica-Nava,conf/icra/CardonaATCM21,https://doi.org/10.1109/ICRA48506.2021.9561513,Robotics
There and Back Again: Self-supervised Multispectral Correspondence Estimation.,2021,Celyn Walters & Oscar Mendez Maldonado & Mark Johnson & Richard Bowden,conf/icra/WaltersMJB21,https://doi.org/10.1109/ICRA48506.2021.9561621,Robotics
Adaptive Discrete-Time Sliding Mode Impedance Control of a Piezoelectric Microgripper.,2013,Qingsong Xu,journals/trob/Xu13,https://doi.org/10.1109/TRO.2013.2239554,Robotics
Everybody Needs Somebody Sometimes: Validation of Adaptive Recovery in Robotic Space Operations.,2019,Steve McGuire & P. Michael Furlong & Terry Fong & Christoffer Heckman & Daniel Szafir & Simon J. Julier & Nisar R. Ahmed,journals/ral/McGuireFFHSJA19,https://doi.org/10.1109/LRA.2019.2894381,Robotics
Automatic kinematic chain calibration using artificial skin: Self-touch in the iCub humanoid robot.,2014,Alessandro Roncone & Matej Hoffmann & Ugo Pattacini & Giorgio Metta,conf/icra/RonconeHPM14,https://doi.org/10.1109/ICRA.2014.6907178,Robotics
Global Vision-Based Reconstruction of Three-Dimensional Road Surfaces Using Adaptive Extended Kalman Filter.,2019,Diya Li & Tomonari Furukawa,conf/icra/LiF19,https://doi.org/10.1109/ICRA.2019.8794039,Robotics
Manipulation for self-Identification; and self-Identification for better manipulation.,2021,Kaiyu Hang & Walter G. Bircher & Andrew S. Morgan & Aaron M. Dollar,journals/scirobotics/HangBMD21,https://doi.org/10.1126/scirobotics.abe1321,Robotics
Autonomous navigation of hexapod robots with vision-based controller adaptation.,2017,Marko Bjelonic & Timon Homberger & Navinda Kottege & Paulo V. K. Borges & Margarita Chli & Philipp Beckerle,conf/icra/BjelonicHKBCB17,https://doi.org/10.1109/ICRA.2017.7989655,Robotics
Optimal Path Planning in Time-Varying Flows Using Adaptive Discretization.,2018,Dhanushka Kularatne & Subhrajit Bhattacharya & M. Ani Hsieh,journals/ral/KularatneBH18,https://doi.org/10.1109/LRA.2017.2761939,Robotics
Self-Assessment of Grasp Affordance Transfer.,2020,Paola Ardón & Èric Pairet & Yvan R. Pétillot & Ronald P. A. Petrick & Subramanian Ramamoorthy & Katrin S. Lohan,conf/iros/ArdonPPPRL20,https://doi.org/10.1109/IROS45743.2020.9340841,Robotics
CHIME: An Adaptive Hierarchical Representation for Continuous Intrinsically Motivated Exploration.,2019,Alexandre Manoury & Sao Mai Nguyen & Cédric Buche,conf/irc/ManouryNB19,https://doi.org/10.1109/IRC.2019.00032,Robotics
Brno Urban Dataset - The New Data for Self-Driving Agents and Mapping Tasks.,2020,Adam Ligocki & Ales Jelinek & Ludek Zalud,conf/icra/LigockiJZ20,https://doi.org/10.1109/ICRA40945.2020.9197277,Robotics
GPU-based dynamic search on adaptive resolution grids.,2014,Francisco M. Garcia & Mubbasir Kapadia & Norman I. Badler,conf/icra/GarciaKB14,https://doi.org/10.1109/ICRA.2014.6907070,Robotics
Deterministic distributed algorithm for self-reconfiguration of modular robots from arbitrary to straight chain configurations.,2013,Stanton Wong & Jennifer Walter,conf/icra/WongW13,https://doi.org/10.1109/ICRA.2013.6630626,Robotics
RCA: Ride Comfort-Aware Visual Navigation via Self-Supervised Learning.,2022,Xinjie Yao & Ji Zhang & Jean Oh,conf/iros/YaoZO22,https://doi.org/10.1109/IROS47612.2022.9981494,Robotics
Self-calibrating multi-camera visual-inertial fusion for autonomous MAVs.,2016,Zhenfei Yang & Tianbo Liu 0001 & Shaojie Shen,conf/iros/YangLS16,https://doi.org/10.1109/IROS.2016.7759732,Robotics
Real-time Multi-Adaptive-Resolution-Surfel 6D LiDAR Odometry using Continuous-time Trajectory Optimization.,2021,Jan Quenzel & Sven Behnke,conf/iros/QuenzelB21,https://doi.org/10.1109/IROS51168.2021.9636763,Robotics
Adaptive Gradient-Descent Extended Kalman Filter for Pose Estimation of Mobile Robots with Sparse Reference Signals.,2022,Ákos Odry & István Kecskés & Dominik Csík & Hashim A. Hashim & Peter Sarcevic,conf/iros/OdryKCHS22,https://doi.org/10.1109/IROS47612.2022.9981893,Robotics
mRUBiS: an exemplar for model-based architectural self-healing and self-optimization.,2018,Thomas Vogel 0001,conf/icse/Vogel18,https://doi.org/10.1145/3194133.3194161,Self-Adaptive_Systems
SSTN: Self-Supervised Domain Adaptation Thermal Object Detection for Autonomous Driving.,2021,Farzeen Munir & Shoaib Azam & Moongu Jeon,conf/iros/MunirAJ21,https://doi.org/10.1109/IROS51168.2021.9636353,Robotics
Leveraging RGB-D Data: Adaptive fusion and domain adaptation for object detection.,2012,Luciano Spinello & Kai Oliver Arras,conf/icra/SpinelloA12,https://doi.org/10.1109/ICRA.2012.6225137,Robotics
Meta Reinforcement Learning for Sim-to-real Domain Adaptation.,2020,Karol Arndt & Murtaza Hazara & Ali Ghadirzadeh & Ville Kyrki,conf/icra/ArndtHGK20,https://doi.org/10.1109/ICRA40945.2020.9196540,Robotics
Adaptive control for robot manipulators under ellipsoidal task space constraints.,2012,Keng Peng Tee & Shuzhi Sam Ge & Rui Yan 0005 & Haizhou Li 0001,conf/iros/TeeGYL12,https://doi.org/10.1109/IROS.2012.6386257,Robotics
Dry-wireless EEG and asynchronous adaptive feature extraction towards a plug-and-play co-adaptive brain robot interface.,2016,Giuseppe Lisi & Masashi Hamaya & Tomoyuki Noda & Jun Morimoto,conf/icra/LisiHNM16,https://doi.org/10.1109/ICRA.2016.7487227,Robotics
Probabilistic Adaptive Control for Robust Behavior Imitation.,2021,Julius Jankowski & Hakan Girgin & Sylvain Calinon,journals/ral/JankowskiGC21,https://doi.org/10.1109/LRA.2021.3061310,Robotics
Consensus-Based Peer-to-Peer Control Architecture for Multiuser Haptic Interaction Over the Internet.,2013,Ke Huang & Dongjun Lee,journals/trob/HuangL13,https://doi.org/10.1109/TRO.2012.2229672,Robotics
Adaptive Control of Variable-Pitch Propellers: Pursuing Minimum-Effort Operation.,2020,Travis Henderson & Nikolaos Papanikolopoulos,conf/icra/HendersonP20,https://doi.org/10.1109/ICRA40945.2020.9197208,Robotics
Adaptive Gait Planning for Walking Assistance Lower Limb Exoskeletons in Slope Scenarios.,2019,Chaobin Zou & Rui Huang 0008 & Hong Cheng 0002 & Qiming Chen & Jing Qiu 0004,conf/icra/ZouHCCQ19,https://doi.org/10.1109/ICRA.2019.8793863,Robotics
On the role duality and switching in human-robot cooperation: An adaptive approach.,2015,Bryan Whitsell & Panagiotis K. Artemiadis,conf/icra/WhitsellA15,https://doi.org/10.1109/ICRA.2015.7139723,Robotics
A self-deployable origami structure with locking mechanism induced by buckling effect.,2015,Jongwoo Kim & Dae-Young Lee & Sa-Reum Kim & Kyu-Jin Cho,conf/icra/KimLKC15,https://doi.org/10.1109/ICRA.2015.7139635,Robotics
Two-Stream Based Multi-Stage Hybrid Decoder for Self-Supervised Multi-Frame Monocular Depth.,2022,Yangqi Long & Huimin Yu & Biyang Liu,journals/ral/LongYL22,https://doi.org/10.1109/LRA.2022.3214787,Robotics
Cognitive Robotic Architecture for Semi-Autonomous Execution of Manipulation Tasks in a Surgical Environment.,2019,Giacomo De Rossi & Marco Minelli & Alessio Sozzi & Nicola Piccinelli & Federica Ferraguti & Francesco Setti & Marcello Bonfè & Cristian Secchi & Riccardo Muradore,conf/iros/RossiMSPFSBSM19,https://doi.org/10.1109/IROS40897.2019.8967667,Robotics
Implicit gaze-assisted adaptive motion scaling for highly articulated instrument manipulation.,2017,Gauthier Gras & Konrad Leibrandt & Piyamate Wisanuvej & Petros Giataganas & Carlo A. Seneci & Menglong Ye & Jianzhong Shang & Guang-Zhong Yang,conf/icra/GrasLWGSYSY17,https://doi.org/10.1109/ICRA.2017.7989488,Robotics
Full-body exoskeleton robot control for walking assistance by style-phase adaptive pattern generation.,2012,Takamitsu Matsubara & Akimasa Uchikata & Jun Morimoto,conf/iros/MatsubaraUM12,https://doi.org/10.1109/IROS.2012.6385528,Robotics
Drift-correcting self-calibration for visual-inertial SLAM.,2017,Fernando Nobre & Michael Kasper & Christoffer R. Heckman,conf/icra/NobreKH17,https://doi.org/10.1109/ICRA.2017.7989771,Robotics
Long-Time Self-Body Image Acquisition and Its Application to the Control of Musculoskeletal Structures.,2019,Kento Kawaharazuka & Kei Tsuzuki & Shogo Makino & Moritaka Onitsuka & Yuki Asano & Kei Okada & Koji Kawasaki & Masayuki Inaba,journals/ral/KawaharazukaTMO19,https://doi.org/10.1109/LRA.2019.2923968,Robotics
Robust LiDAR-based localization in architectural floor plans.,2017,Federico Boniardi & Tim Caselitz & Rainer Kümmerle & Wolfram Burgard,conf/iros/BoniardiCKB17,https://doi.org/10.1109/IROS.2017.8206168,Robotics
Adaptive Constrained Kinematic Control Using Partial or Complete Task-Space Measurements.,2022,Murilo Marques Marinho & Bruno Vilhena Adorno,journals/trob/MarinhoA22,https://doi.org/10.1109/TRO.2022.3181047,Robotics
A-SEE: Active-Sensing End-Effector Enabled Probe Self-Normal-Positioning for Robotic Ultrasound Imaging Applications.,2022,Xihan Ma & Wen-Yi Kuo & Kehan Yang & Ashiqur Rahaman & Haichong K. Zhang,journals/ral/MaKYRZ22,https://doi.org/10.1109/LRA.2022.3218183,Robotics
Safe and Efficient Model-free Adaptive Control via Bayesian Optimization.,2021,Christopher König & Matteo Turchetta & John Lygeros & Alisa Rupenyan & Andreas Krause 0001,conf/icra/KonigTLR021,https://doi.org/10.1109/ICRA48506.2021.9561349,Robotics
Barrier-Certified Adaptive Reinforcement Learning With Applications to Brushbot Navigation.,2019,Motoya Ohnishi & Li Wang 0050 & Gennaro Notomista & Magnus Egerstedt,journals/trob/OhnishiWNE19,https://doi.org/10.1109/TRO.2019.2920206,Robotics
